Book	Chapter	Verse	ID	SupportReference	OrigQuote	Occurrence	GLQuote	OccurrenceNote
GEN	1	1	ax17	figs-abstractnouns	בְּ⁠רֵאשִׁ֖ית	1	In the beginning	“At the beginning {of time/everything}” or “{Everything} began when”. Many Bible scholars think that verse one records God’s first act in creating the universe. This is also the traditional, historically-held view and fits with the narrative structure of the Hebrew text, as well as the wider context of Scriptures which states that God created everything out of nothing at the very beginning of the world (Psalm 33:6, 9; Hebrews 11:3). See the chapter introduction for more details about different interpretations of Genesis 1:1. Also, some languages must use a verb (“began”) in verse 1 rather than a noun (“beginning”). Do what is best in your language. (See: [[rc://en/ta/man/translate/figs-abstractnouns]])
GEN	1	1	ic3y	translate-key-terms	אֱלֹהִ֑ים	1	God	Translate the title “God” in a way that refers to the Supreme Being who created everything, who has complete power, who knows everything and is present everywhere. He is the only true God and has always existed. (See: [[rc://en/ta/man/translate/translate-key-terms]])
GEN	1	1	th1c	translate-key-terms	בָּרָ֣א	1	created	“made”. In the Hebrew Bible, the verb “create” refers to an activity that only God does, and it often implies (as it does here) that he made something out of nothing. Also, the forms of the verbs in the Hebrew text (and the conjunctions) show that chapter one is a narrative that tells about true history and events in the order that things actually happened. Make sure that your translation does the same thing. (See: [[rc://en/ta/man/translate/translate-key-terms]])
GEN	1	1	k70s	translate-key-terms	אֵ֥ת הַ⁠שָּׁמַ֖יִם	1	the heavens	“the sky”. This phrase refers here to the region where all the stars and planets would later exist. Keep that in mind as you translate this term. (See: [[rc://en/ta/man/translate/translate-key-terms]])
GEN	1	1	c00a	translate-key-terms	וְ⁠אֵ֥ת הָ⁠אָֽרֶץ	1	and the earth.	This phrase refers to the planet earth. (See: [[rc://en/ta/man/translate/translate-key-terms]])
GEN	1	2	u0s6		וְ⁠הָ⁠אָ֗רֶץ	1	Now the earth	“Now {at first after that,} the earth” or “{At first after that,} the earth”. The author pauses here to describe what the earth was like after God first created it (verse 1). Some languages use a conjunction like “Now” to introduce that information; other languages do not use a conjunction here. Do what is natural in your language. Also, be consistent here with how you translated “the earth” in verse 1.
GEN	1	2	je1w		הָיְתָ֥ה תֹ֨הוּ֙ וָ⁠בֹ֔הוּ	1	was formless and empty,	It is not clear what the earth looked like at that time, but it did not have its present shape and order. Also, the Hebrew text is ambiguous here. It can mean (1) “was formless/shapeless and empty/desolate,” or “did not have {its present} form, and there was nothing {living} on it {yet},” (2) “completely empty/desolate,” which is a hendiadys. However it is best to keep both terms separate in your translation (as in the first interpretation).
GEN	1	2	ehsa		וְ⁠חֹ֖שֶׁךְ עַל פְּנֵ֣י תְה֑וֹם	1	and darkness {was} over the surface of the deep {waters},	“It was {totally/completely} dark, there was deep {water} {everywhere},” or “There was deep {water} {everywhere} {that was covered/surrounded} in/by {complete/total} darkness,” For some languages it is more natural to begin a new sentence here. Do what is best in your language.
GEN	1	2	l2hu		וְ⁠ר֣וּחַ אֱלֹהִ֔ים מְרַחֶ֖פֶת	1	and the Spirit of God was hovering	The Hebrew text is ambiguous here. It can mean (1) “and God’s Spirit was hovering/moving” (2) “and a wind from God was blowing” (3) “and a powerful wind was blowing”. The first interpretation is most likely, since the Hebrew verb “hovering” does not describe what wind does.
GEN	1	2	vyre		עַל פְּנֵ֥י הַ⁠מָּֽיִם	1	over the surface of the waters.	“over the surface of the water.” or “above the waters/water.” Throughout this chapter, the word “waters” is in the plural in the Hebrew text. For some languages it is more natural to use the singular “water”. Do what is best in your language in each context.
GEN	1	3	qe1j	writing-quotations	וַ⁠יֹּ֥אמֶר אֱלֹהִ֖ים	1	Then God said,	“Then God commanded,” What God says in verse 3 is a command. Consider whether or not it is best in your language to make that explicit in this quote margin. (See: [[rc://en/ta/man/translate/writing-quotations]])
GEN	1	3	a4w4		יְהִ֣י א֑וֹר	1	“Let there be light.”	“Let light exist.” or “I command there to be light.” or “I command light to start shining!” This is a command, not permission or a suggestion. It is a direct quote of what God actually said, and it is usually put between quotation marks in a translation. If you use an exclamation mark with this command in your translation, make sure it does not mean or imply that God was angry. Also, the way you translate “light” should refer to what shines from a source of light; it does not refer here to the source itself.
GEN	1	3	opxl		וַֽ⁠יְהִי אֽוֹר	1	And there was light.	“And/So {immediately} there was light.” or “And {so/immediately} light started shining.” Light began to shine immediately as a result of God’s command.
GEN	1	4	zfnn	grammar-connect-words-phrases	וַ⁠יַּ֧רְא אֱלֹהִ֛ים	1	And God saw	“And he saw/observed” or “God/He saw/observed”. Notice that Hebrew frequently uses a conjunction such as “And” or “Then” at the beginning of a sentence. Some languages do not use conjunctions as frequently as Hebrew does. Do what is accurate and natural in your language in each context. (See: [[rc://en/ta/man/translate/grammar-connect-words-phrases]])
GEN	1	4	l24u	translate-key-terms	אֶת הָ⁠א֖וֹר כִּי ט֑וֹב	1	the light, that {it was} good.	“that the light {was} good/excellent.” In the Bible, “good” is an important theme. Throughout chapter one, it especially means that what God created was high quality, complete, and had no defects; in other words, it had all the characteristics and functions that God intended it to have. It also includes the idea that what God created was untainted by sin and reflected his good character (Psalm 19:1; Romans 1:20). The focus here is not on how pleased or satisfied God was. (See: [[rc://en/ta/man/translate/translate-key-terms]])
GEN	1	4	zt0z	writing-pronouns	וַ⁠יַּבְדֵּ֣ל אֱלֹהִ֔ים	1	Then God	“Then he”. In order to produce an accurate and natural translation, it is important in each context to make sure that nouns (such as “God”) and pronouns (such as “he”) are used properly in your language. In the Hebrew text, “God” is repeated frequently in chapter one to emphasize him and show that he is in focus. For some languages it is more natural to say “God” only once at the beginning of each paragraph or section, and then use pronouns to refer to him the rest of the time (or most of the time). Throughout chapter one, do what is best in your language each time that God is referred to. (See: [[rc://en/ta/man/translate/writing-pronouns]])
GEN	1	4	ynnj		וַ⁠יַּבְדֵּ֣ל בֵּ֥ין הָ⁠א֖וֹר וּ⁠בֵ֥ין הַ⁠חֹֽשֶׁךְ	1	separated between the light and the darkness.	“separated/divided the light from the darkness {so that each had its own time}.” or “caused the light to have its own time and the darkness to have its own time.” or “separated the light from the darkness {so that it would be light for a number of hours, and then dark for a number of hours}.”
GEN	1	5	k92z	grammar-connect-words-phrases	וַ⁠יִּקְרָ֨א אֱלֹהִ֤ים	1	And God called	“Then God/he called/named” or “God/He called/named”. Some languages omit the connecting word “And” or “Then” here. Consider the best way in your language to connect this sentence with the previous one. (See: [[rc://en/ta/man/translate/grammar-connect-words-phrases]])
GEN	1	5	v4xk		לָ⁠אוֹר֙ י֔וֹם	1	the light Day,	“the light Daytime.” Notice that in this context the word “Day” refers only to the time when the sun is shining, not to the 24-hour time period that makes up a complete day. Make sure that this is clear in your translation. Throughout chapter one, some translations use quote marks around the names that God gives the different things he created.
GEN	1	5	vagh		וְ⁠לַ⁠חֹ֖שֶׁךְ קָ֣רָא לָ֑יְלָה	1	and the darkness he called Night.	“and the darkness he called/named Nighttime.” or “and he called/named the darkness Nighttime.” In the Hebrew text, “the darkness” is first in this clause to emphasize the contrast between the light and the darkness. Consider the best way to translate this clause in your language.
GEN	1	5	ibn4	grammar-connect-time-sequential	וַֽ⁠יְהִי עֶ֥רֶב וַֽ⁠יְהִי בֹ֖קֶר	0	Then there was evening, and there was morning,	“Then evening came and {then/later} morning came,” The evening and the morning are the parts of a 24-hour day that separate the hours of daytime (light) from the hours of nighttime (darkness): Evening came at the end of each daytime after God finished his work of creating. Then after about 12 hours of nighttime, morning came, which began the next 12 hours of daytime when God did more work. Make sure your translation does not sound like morning came immediately after evening. Some languages have a one-word conjunction that means “and then” or “and later” that fits well here. (See: [[rc://en/ta/man/translate/grammar-connect-time-sequential]])
GEN	1	5	cbfn	translate-ordinal	י֥וֹם אֶחָֽד	1	one day.	“{and that was} day one.” or “{and that was} {the end of} the first day.” Here “day” refers to a full 24-hour day. Also, the Hebrew text uses a cardinal number (“one”) here, but then uses ordinal numbers (“second”, “third”, and so on) for the rest of the days of creation week. Some languages need to use an ordinal number (“first”) here too. Other languages use cardinal numbers throughout (“day one”, “day two”, and so on). Do what is best in your language. (See: [[rc://en/ta/man/translate/translate-ordinal]])
GEN	1	6	qgjp	writing-quotations	וַ⁠יֹּ֣אמֶר אֱלֹהִ֔ים	1	Then God said,	“Then God commanded,” See how you translated this phrase in verse 3. (See: [[rc://en/ta/man/translate/writing-quotations]])
GEN	1	6	b07i		יְהִ֥י רָקִ֖יעַ	1	“Let there be an expanse	“Let there be a large/vast space” or “I command there to be a {large/vast} expanse/space” or “I command a large/vast space to form/exist”. The Hebrew word for “expanse” here describes a large space that is “spread out.” It was not solid, rather it was open and empty and could be seen through and flown through (verse 20). It was probably also curved, following the spherical shape of the earth. See how you translated “Let there be” in verse 3.
GEN	1	6	h25k		בְּ⁠ת֣וֹךְ הַ⁠מָּ֑יִם	1	in the middle of the waters,	“in the middle of the water,” See how you translated “waters” in verse 2.
GEN	1	6	jqx5		מַ֖יִם לָ⁠מָֽיִם	1	and let it separate the waters from the waters.”	“and let it separate/divide the water {above it} from the water {below it}.” or “so that it separates/divides the waters/water into two separate/different places.”
GEN	1	7	coip		וַ⁠יַּ֣עַשׂ אֱלֹהִים֮	1	So God made	“In that way God/he made/created” or “That is how God/he made/created”. Verse 7 explains what God’s command in verse 6 caused to happen, and it repeats some of the same words and phrases. Make sure that your translation of these verses does not sound like God created the expanse twice.
GEN	1	7	k473		אֶת הָ⁠רָקִיעַ֒	1	the expanse	“a large/vast space”
GEN	1	7	c4wk		וַ⁠יַּבְדֵּ֗ל	1	and separated	“and divided” or “and used it to separate/divide”
GEN	1	7	tdid	writing-pronouns	בֵּ֤ין הַ⁠מַּ֨יִם֙ אֲשֶׁר֙ מִ⁠תַּ֣חַת לָ⁠רָקִ֔יעַ וּ⁠בֵ֣ין הַ⁠מַּ֔יִם אֲשֶׁ֖ר מֵ⁠עַ֣ל לָ⁠רָקִ֑יעַ	1	between the waters that {were} under the expanse and the waters that {were} above the expanse.	“the water that {was} below the expanse/space from the water that {was} above it.” or “the water that {was} under/below it from the water that {was} above it.” For some languages it is more natural to use a pronoun (“it”) here to refer to the expanse, since it was just mentioned earlier in the verse. Each language has its own system of when to use nouns or pronouns to refer to people, places and things. In each context, do what is clear and natural in your language. (See: [[rc://en/ta/man/translate/writing-pronouns]])
GEN	1	7	p5mn	figs-explicit	וַֽ⁠יְהִי כֵֽן	1	And it was so.	“That is the way it happened.” or “Everything was/happened {exactly} as he commanded {it to be/happen}.” (See: [[rc://en/ta/man/translate/figs-explicit]])
GEN	1	8	w651	grammar-connect-words-phrases	וַ⁠יִּקְרָ֧א אֱלֹהִ֛ים	1	And God called	“and God/he called/named” or “God/He called/named”. Consider whether it is more natural in your language to begin a new sentence here (with or without a conjunction), or to continue the sentence that began at the end of verse 7. Also see how you translated this phrase in verse 5. (See: [[rc://en/ta/man/translate/grammar-connect-words-phrases]])
GEN	1	8	a0bw		לָֽ⁠רָקִ֖יעַ	1	the expanse	“the large/vast space”. See how you translated this phrase in verses 6 and 7.
GEN	1	8	h2yj	translate-key-terms	שָׁמָ֑יִם	1	Heavens.	“Sky.” This word probably refers here to the atmosphere above the earth’s surface where clouds are and where birds fly, as well as the space where the sun, moon, and stars are now. See how you translated this term in verse 1. (See: [[rc://en/ta/man/translate/translate-key-terms]])
GEN	1	8	ufym		וַֽ⁠יְהִי עֶ֥רֶב וַֽ⁠יְהִי בֹ֖קֶר	1	Then there was evening, and there was morning,	“Then evening came and {then/later} morning came,” See how you translated this sentence in verse 5, and see the note about that there.
GEN	1	8	ptrz	translate-ordinal	י֥וֹם שֵׁנִֽי	1	the second day.	“{and that was} {the end of} the second day.” or “{and} the second day ended.” or “{and that was} {the end of} day two.” Consider whether it is more natural in your language to use an ordinal number (“second”) here or a cardinal number (“two”). (See: [[rc://en/ta/man/translate/translate-ordinal]])
GEN	1	9	nsft	writing-quotations	וַ⁠יֹּ֣אמֶר אֱלֹהִ֗ים	1	Then God said,	“Then God commanded,” See how you translated this phrase in verses 3 and 6. (See: [[rc://en/ta/man/translate/writing-quotations]])
GEN	1	9	mlab	figs-activepassive	יִקָּו֨וּ הַ⁠מַּ֜יִם מִ⁠תַּ֤חַת הַ⁠שָּׁמַ֨יִם֙	1	“Let the waters under the heavens be gathered	“Let the water {that is} under the heavens/sky gather/come together” or “I command the water {that is} below the heavens/sky to gather/come together”. Consider whether it is better here in your language to use a passive form of the verb (“be gathered”) or an active form (“gather” or “come”). (See: [[rc://en/ta/man/translate/figs-activepassive]])
GEN	1	9	nosf		אֶל מָק֣וֹם אֶחָ֔ד	1	to one place,	“in one place/area” or “into one area”
GEN	1	9	u9q3		וְ⁠תֵרָאֶ֖ה הַ⁠יַּבָּשָׁ֑ה	1	and let the dry ground appear.”	“so that there is dry ground/land.” or “so that dry ground/land can be seen.” or “so that land is uncovered and dries off.” The water had been covering the land, so when the water receded from it, the land became exposed and dried off. Make sure that the way you translate “dry ground” does not sound like the land was dry while it was under the water.
GEN	1	9	u1i5		וַֽ⁠יְהִי כֵֽן	1	And it was so.	“And that is {exactly} what happened.” or “And it was/happened {exactly} as God commanded {it to be/happen}.” See how you translated this sentence in verse 7. It may be necessary to translate it in different ways, depending on the context.
GEN	1	10	urzv		וַ⁠יִּקְרָ֨א אֱלֹהִ֤ים	1	And God called	“Then God/he called/named”
GEN	1	10	tpui		לַ⁠יַּבָּשָׁה֙	1	the dry ground	“the dry land” or “the ground/land that had dried off”
GEN	1	10	vz3b		אֶ֔רֶץ	1	Land,	“Ground,” This is the same Hebrew word that is translated as “earth” in verse 1, but here it refers to the dry land or ground (in contrast to the water), not the entire planet.
GEN	1	10	t1mu	figs-infostructure	וּ⁠לְ⁠מִקְוֵ֥ה הַ⁠מַּ֖יִם קָרָ֣א	1	and the gathered waters he called	“and the waters/water that he had gathered together he called/named” or “and he called/named the gathered waters” or “and he called/named the waters/water that had gathered/come together”. See how you translated a sentence in verse 5 that is similar in structure to this sentence. (See: [[rc://en/ta/man/translate/figs-infostructure]])
GEN	1	10	akm3		יַמִּ֑ים	1	Seas.	“Oceans.” or “Sea/Ocean.” At that time there was probably just one very large body of water and one very large land mass on the earth (as verse 9 indicates). So a singular noun that refers to the largest body of water, such as “Ocean” or “Sea”, could be used here in your translation.
GEN	1	10	innb	writing-pronouns	וַ⁠יַּ֥רְא אֱלֹהִ֖ים	1	And God saw	“And he saw/observed” or “God/He saw/observed”. Decide whether it is more natural in your language to use a noun (“God”) or a pronoun (“he”) in this context. See how you translated this phrase in verse 4. (See: [[rc://en/ta/man/translate/writing-pronouns]])
GEN	1	10	qpyo		כִּי טֽוֹב	1	that {it was} good.	“that {what he had made was} good/excellent.” or “that {the land and the seas/ocean were} good/excellent.” Some languages cannot use a pronoun (“it”) here, but have to specify what was good. Do what is best in your language. Also see how you translated the word “good” in verse 4, and see the note about that there.
GEN	1	11	gq63	writing-quotations	וַ⁠יֹּ֣אמֶר אֱלֹהִ֗ים	1	Then God said,	“Then God commanded,” (See: [[rc://en/ta/man/translate/writing-quotations]])
GEN	1	11	ydgm		תַּֽדְשֵׁ֤א הָ⁠אָ֨רֶץ֙	1	“Let the land	“I command the land/ground to” or “The land/ground must now”. Notice that when God commands the land to do something, it obeys him. See how you translated “Land” in verse 10.
GEN	1	11	l9x6		תַּֽדְשֵׁ֤א דֶּ֔שֶׁא	1	sprout vegetation:	“grow/produce {green} plants,” or “be covered with {green} plants,” The Hebrew word for “vegetation” refers generally here to any kind of green plant and includes the plants and trees that are mentioned next in this verse.
GEN	1	11	niqr		עֵ֚שֶׂב מַזְרִ֣יעַ זֶ֔רַע	1	{every} plant yielding seed,	“{including} {every kind/type of} plant that produces/has seeds” or “{including} {all kinds/types of} plants that produce/have seeds”. This phrase refers to many different kinds of plants, not just one plant or one seed. Make sure that is clear in your translation. Also, these kinds of plants have soft stems and include vegetable plants, herbs and other plants that produce edible seeds, such as rice, corn and wheat.
GEN	1	11	bz9s		עֵ֣ץ פְּרִ֞י עֹ֤שֶׂה פְּרִי֙ לְ⁠מִינ֔⁠וֹ	1	{every} fruit tree bearing fruit according to its kind,	“{and} fruit trees that bear/produce fruit, {each} according to its {own} kind/type,” or “{and} {every kind/type of} fruit tree that bears/produces/has its own kind/type of fruit” or “{and} {all kinds/types of} fruit trees that bear/produce/have their own kind/type of fruit”. The phrase “according to its kind” emphasizes that each different kind of tree produces its own kind of fruit and seeds, which grow and become only that kind of tree. For example, apple trees always produce apples with apple seeds, never peaches or cherries, or any other kind of fruit or seeds.
GEN	1	11	jwpm		אֲשֶׁ֥ר זַרְע⁠וֹ ב֖⁠וֹ	1	that {has} its seed inside it,	“that {has} seeds inside,” or “with seeds inside,” or “with its {own kind/type of} seeds inside it,”
GEN	1	11	n5v5	figs-infostructure	עַל הָ⁠אָ֑רֶץ	1	on the earth.”	“throughout the earth.” or “all over the earth.” For some languages it is clearer and more natural to put this phrase earlier in this verse and say, “Let the land sprout vegetation on/throughout the earth...” Do what is best in your language. (See: [[rc://en/ta/man/translate/figs-infostructure]])
GEN	1	11	pn2g		וַֽ⁠יְהִי כֵֽן	1	And it was so.	“And that is {exactly} what happened:” or “And it/everything happened {exactly} as God commanded {it to happen}:” Either a period or a colon can be used here, but a colon more clearly shows that verse 12 gives the details of what happened. This is different from verse 7 where the details of what happened come before “And it was so”, and from verse 9 where no additional details are given.
GEN	1	12	nlty		וַ⁠תּוֹצֵ֨א הָ⁠אָ֜רֶץ דֶּ֠שֶׁא	1	So the land brought out vegetation:	“The land sprouted/produced vegetation/plants,” or “The land started growing/producing {green} plants,” Verse 12 explains what God’s command in verse 11 caused to happen, and it repeats some of the same words and phrases. Make sure that your translation of these verses does not sound like God created the plants twice.
GEN	1	12	o9qy		עֵ֣שֶׂב מַזְרִ֤יעַ זֶ֨רַע֙ לְ⁠מִינֵ֔⁠הוּ	1	{every} plant yielding seed according to its kind,	“{including} plants that produce/have seeds, {each} according to its {own} kind/type,” or “{including} {every kind/type of} plant that produces/has seeds that grow into the same kind/type of plant,” or “{including} {all kinds/types of} plants that produce/have their own kind/type of seeds,”
GEN	1	12	lsk9		NO OrigLQuote AVAILABLE!!!	1	and {every} tree bearing fruit that {has} its seeds inside it, according to its kind.	“and trees that bear/produce fruit with seeds inside, {each} according to its {own} kind” or “and {every kind/type of} tree that produces/has fruit with seeds that grow into the same kind/type of tree.” or “and {all kinds/types of} trees that {produce/have} their own kind/type of seed-bearing fruit.”
GEN	1	12	gzal	grammar-connect-words-phrases	וַ⁠יַּ֥רְא אֱלֹהִ֖ים	1	And God saw	“And he saw/observed” or “God/He saw/observed”. Consider whether or not it is more natural in your language to begin this sentence with a conjunction. (See: [[rc://en/ta/man/translate/grammar-connect-words-phrases]])
GEN	1	12	k8n4	figs-explicit	כִּי טֽוֹב	1	that {it was} good.	“that {what he had made/created was} good/excellent.” or “that {all the plants and trees were} good/excellent.” See how you translated this clause in verse 10. Some languages have to specify what was good. Do what is best in your language. (See: [[rc://en/ta/man/translate/figs-explicit]])
GEN	1	13	s0ib		וַֽ⁠יְהִי עֶ֥רֶב וַֽ⁠יְהִי בֹ֖קֶר	1	Then there was evening, and there was morning,	“Then evening came and {then/later} morning came,” See how you translated this sentence in verses 5 and 8.
GEN	1	13	yqc6	translate-ordinal	י֥וֹם שְׁלִישִֽׁי	1	the third day.	“{and that was} {the end of} the third day.” or “{and} the third day {ended}.” or “{and that was} {the end of} day three.” (See: [[rc://en/ta/man/translate/translate-ordinal]])
GEN	1	14	re7y	writing-quotations	וַ⁠יֹּ֣אמֶר אֱלֹהִ֗ים	1	Then God said,	“Then God commanded,” (See: [[rc://en/ta/man/translate/writing-quotations]])
GEN	1	14	kbta		יְהִ֤י מְאֹרֹת֙	1	“Let there be lights	“Let lights/lamps appear/exist” or “I command there to be sources of light” or “Let there be things/objects that give/shine light”. These lights refer to the sun, moon and stars that give off light. But it is important to keep this general in your translation (like the Hebrew text does) and not specify the names of these lights.
GEN	1	14	ib7w		בִּ⁠רְקִ֣יעַ הַ⁠שָּׁמַ֔יִם	1	in the expanse of the heavens	“in the expanse/space of/called the heavens/sky” or “in the open space of the heavens/sky” or “in the heavens/sky”. The expanse is the same thing as the heavens (verse 8), so some translations leave “the expanse of” implied here. Do what is best in your language.
GEN	1	14	zuhs		לְ⁠הַבְדִּ֕יל	1	to separate	“to divide/distinguish” or “that separate/divide”
GEN	1	14	i9sz		בֵּ֥ין הַ⁠יּ֖וֹם וּ⁠בֵ֣ין הַ⁠לָּ֑יְלָה	1	between the day and the night.	“the day{time} from the night{time}.” See how you translated “Day{time}” and “Night{time}” in verse 5.
GEN	1	14	hof1		וְ⁠הָי֤וּ לְ⁠אֹתֹת֙	1	And let them be for	“Let those lights/lamps also be” or “They must/will also serve/function as” or “I also command those lights/lamps to serve/function as”
